113	місто Сватове	Білокуракинський, Кремінський, Новоайдарський, Сватівський, Старобільський, Троїцький райони	пл.50-річчя Перемоги, 37, м.Сватове, Сватівський р-н, Луганська обл., 92600	молодіжний центр "Слобожанська духовна криниця ім.М.Щепенка"	203	159 090
114	селище міського типу Станиця Луганська	Біловодський, Марківський, Міловський, Новопсковський, Слов’яносербський, Станично-Луганський райони	вул.1 Травня, 33, смтСтаниця Луганська, Станично-Луганський р-н, Луганська обл., 93600	цех телекомунікаційних послуг № 10 Луганської філії ПАТ "Укртелеком"	198	154 032
115	місто Львів, Сихівський район	Сихівський район, частина Личаківського району міста Львова (виборчі дільниці № 461925 – 461928, 461931, 461935, 461936, 461940 –461942, 461947 – 461950, 461954 – 461959, 461962 – 461975)	вул.Зубрівська, 9, м.Львів, 79066	приміщення управління освіти Львівської міської ради	95	170 995
116	місто Львів, Залізничний район	Залізничний район, частина Шевченківського району міста Львова (виборчі дільниці № 462109 – 462113, 462119 – 462129, 462137 –462150)	вул.Виговського, 34, м.Львів, 79022	приміщення Залізничної районної адміністрації Львівської міської ради	79	178 391
117	місто Львів, Франківський район	Галицький, Франківський райони, частина Шевченківського району міста Львова (виборчі дільниці № 462130 – 462136)	вул.Чупринки, 85, м.Львів, 79044	приміщення Франківської районної адміністрації Львівської міської ради	95	175 125
118	місто Львів, Личаківський район	частина Личаківського (виборчі дільниці № 461929, 461930, 461932 – 461934, 461937 – 461939, 461943 – 461946, 461951 – 461953, 461960, 461961), частина Шевченківського (виборчі дільниці № 462095 – 462108, 462114 – 462118, 462151, 462152) районів міста Львова, Пустомитівський район	вул.К.Левицького, 67, м. Львів, 79017	приміщення Личаківської районної адміністрації Львівської міської ради	137	171 624
119	місто Броди	Бродівський, Буський, Радехівський райони, частина Кам’янка-Бузького району (виборчі дільниці № 460614 – 460618, 460622, 460623, 460625 – 460643, 460649 – 460653, 460658, 460663, 460664, 460670 – 460679)	пл.Ринок, 1, м.Броди, Бродівськийр-н, Львівська обл., 80600	приміщення Бродівської районної ради	248	154 303
120	місто Городок	Городоцький, Мостиський райони, частина Самбірського району (виборчі дільниці № 461059 – 461136, 461140 – 461147)	вул.Майдан Гайдамаків, 5, м.Городок, Городоцький р-н, Львівська обл., 81500	Народний дім "Просвіта"	247	154 134
121	місто Дрогобич	міста Борислав, Дрогобич, Трускавець, Дрогобицький район	вул.22 Січня, 37, м. Дрогобич, Львівська обл., 82100	приміщення Дрогобицької районної ради	143	176 804
122	місто Яворів	Жовківський, Яворівський райони	вул.І.Франка, 8, м.Яворів, Яворівський р-н, Львівська обл., 81000	приміщення Яворівської райдержадміністрації	207	175 091
123	місто Перемишляни	місто Новий Розділ, Золочівський, Миколаївський, Перемишлянський райони	вул.Привокзальна, 3, м.Перемишляни, Перемишлянський р-н, Львівська обл., 81200	приміщення Перемишлянської районної ради	253	160 071
124	місто Сокаль	місто Червоноград, Сокальський район, частина Кам’янка-Бузького району (виборчі дільниці № 460619 – 460621, 460624, 460644 –460648, 460654 – 460657, 460659 – 460662, 460665 – 460669)	вул.Шептицького,26, м.Сокаль, Cокальський р-н, Львівська обл., 80000	приміщення Сокальської районної ради	164	150 504
125	місто Старий Самбір	місто Самбір, Сколівський, Старосамбірський, Турківський райони, частина Самбірського району (виборчі дільниці № 461137 – 461139)	вул.Л.Галицького, 40, м.Старий Самбір, Старосамбірський р-н, Львівська обл., 82000	приміщення Старосамбірської райдержадміністрації	265	164 027
126	місто Стрий	міста Моршин, Стрий, Жидачівський, Стрийський райони	вул.Шевченка, 71, м.Стрий, Львівська обл., 82400	приміщення Стрийської міської ради	223	153 655
127	місто Миколаїв, Заводський район	місто Очаків, Заводський район міста Миколаєва, Миколаївський, Очаківський райони	вул.Чигрина, 9, м.Миколаїв, 54020	приміщення районної адміністрації Миколаївської міської ради по Заводському району	126	155 062
128	місто Миколаїв, Ленінський район	Ленінський, Корабельний райони міста Миколаєва	просп.Жовтневий, 1, м.Миколаїв, 54003	приміщення районної адміністрації Миколаївської міської ради по Ленінському району	92	172 604
129	місто Миколаїв, Центральний район	Центральний район міста Миколаєва, Жовтневий район	вул.Інженерна, 1, м.Миколаїв, 54001	приміщення районної адміністрації Миколаївської міської ради по Центральному району	106	152 428
130	місто Баштанка	Баштанський, Березнегуватський, Казанківський, Новобузький, Новоодеський, Снігурівський райони	вул.Баштанської республіки, 29, м.Баштанка, Баштанський р-н, Миколаївська обл., 56101	Баштанська дитячо-юнацька спортивна школа	236	147 543
131	місто Вознесенськ	міста Вознесенськ, Южноукраїнськ, Березанський, Веселинівський, Вознесенський, Доманівський, Єланецький райони	вул.Кірова, 22, м.Вознесенськ, Миколаївська обл., 56500	Вознесенський міський будинок культури	191	161 553
132	місто Первомайськ	місто Первомайськ, Арбузинський, Братський, Врадіївський, Кривоозерський, Первомайський райони	вул.Грушевського, 3, м.Первомайськ, Миколаївська обл., 55213	приміщення виконавчого комітету Первомайської міської ради	186	149 103
133	місто Одеса, Київський район	Київський район міста Одеси	вул.Академіка Корольова, 9, м.Одеса, 65114	приміщення Київської районної адміністраціїОдеської міської ради	86	178 761
134	місто Одеса, Малиновський район	частина Малиновського району міста Одеси (виборчі дільниці № 511159 –511218, 511220, 511222 – 511244)	вул.Генерала Петрова, 22, м.Одеса, 65078	приміщення Малиновської районної адміністраціїОдеської міської ради	85	177 426
135	місто Одеса, Приморський район	Приморський район міста Одеси	вул.Канатна, 134, м.Одеса, 65039	приміщення Приморської районної адміністрації Одеської міської ради	95	180 297
136	місто Одеса, Суворовський район	частина Малиновського (виборчі дільниці № 511219, 511221), частина Суворовського (виборчі дільниці № 511340 – 511365, 511374 –511434) районів міста Одеси	просп.Добровольського, 106, м.Одеса, 65025	приміщення Суворовської районної адміністрації Одеської міської ради	89	180 127
137	місто Котовськ	місто Котовськ, Балтський, Кодимський, Котовський, Красноокнянський, Савранський райони	вул.50 років Жовтня, 72в, м.Котовськ, Одеська обл., 66300	цех телекомунікаційних послуг №15 Одеської філії ПАТ "Укртелеком"	204	144 471
138	селище міського типу Ширяєве	Ананьївський, Березівський, Іванівський, Любашівський, Миколаївський, Ширяївський райони, частина Комінтернівського району (виборчі дільниці № 510473 – 510498, 510521, 510522)	вул.Леніна, 104, смт Ширяєве, Ширяївський р-н, Одеська обл., 66800	приміщення Ширяївської райдержадміністрації	242	153 182
139	місто Роздільна	місто Южне, частина Суворовського району міста Одеси (виборчі дільниці № 511366 – 511373), Великомихайлівський, Роздільнянський, Фрунзівський райони, частина Біляївського (виборчі дільниці № 510222, 510223, 510230, 510237, 510238, 510241 – 510243, 510246, 510248, 510249, 510252, 510257, 510263 – 510265, 510268, 510269, 510276, 510277), частина Комінтернівського (виборчі дільниці № 510499 – 510520, 510523) районів	вул.Привокзальна, 14, м.Роздільна, Роздільнянський р-н, Одеська обл., 67400	дитячо-юнацька спортивна школа	140	174 259
140	місто Біляївка	міста Іллічівськ, Теплодар, Овідіопольський район, частина Біляївського району (виборчі дільниці № 510224 – 510229, 510231 – 510236, 510239, 510240, 510244, 510245, 510247, 510250, 510251, 510253 – 510256, 510258 – 510262, 510266, 510267, 510270 – 510275, 510278 – 510282)	вул.Гагаріна, 14Б, м.Біляївка, Біляївський р-н, Одеська обл., 67600	Біляївський районний будинок культури	110	178 320
141	місто Татарбунари	місто Білгород-Дністровський, Білгород-Дністровський, Татарбунарський райони, частина Кілійського району (виборчі дільниці № 510407 – 510423, 510425 – 510428, 510431, 510435, 510439, 510440)	вул.Карла Маркса, 31-А, м.Татарбунари, Татарбунарський р-н, Одеська обл., 68100	Татарбунарський районний будинок культури	145	157 413
142	місто Арциз	Арцизький, Саратський, Тарутинський райони, частина Болградського (виборчі дільниці № 510283 – 510290, 510296, 510298 –510315, 510317, 510318), частина Кілійського (виборчі дільниці № 510424, 510429, 510430, 510432 – 510434, 510436 – 510438) районів	вул.Орджонікідзе, 46, м.Арциз, Арцизький р-н, Одеська обл., 68400	приміщення Арцизької райдержадміністрації	155	161 432
143	місто Ізмаїл	місто Ізмаїл, Ізмаїльський, Ренійський райони, частина Болградського району (виборчі дільниці № 510291 – 510295, 510297, 510316)	просп.Суворова, 62, м.Ізмаїл, Одеська обл., 68600	приміщення Ізмаїльської міської ради	116	147 232
144	місто Полтава, Октябрський район	Ленінський, Октябрський райони міста Полтави	вул.Калініна, 30, м.Полтава, 36040	приміщення Октябрської районної у містіПолтаві ради	85	152 971
145	місто Полтава, Київський район	Київський район міста Полтави, Котелевський, Полтавський райони	вул.Маршала Бірюзова, 1/2, м.Полтава, 36014	приміщення виконавчого комітету Київської районної у містіПолтаві ради	132	158 582
146	місто Кременчук	частина Автозаводського району (виборчі дільниці № 531040 –531085, 531099, 531100), Крюківський район міста Кременчука	вул.Квартальна, 14, м.Кременчук, Полтавська обл., 39600	будинок дитячої та юнацької творчості (БДЮТ)	85	149 013
147	місто Миргород	місто Миргород, Диканський, Зіньківський, Миргородський, Решетилівський, Шишацький райони	вул.Гоголя, 107, м.Миргород, Полтавська обл., 37600	приміщення рад мікрорайонів міста Миргорода	190	145 692
148	місто Лубни	місто Лубни, Великобагачанський, Оржицький, Семенівський, Хорольський райони, частина Лубенського району (виборчі дільниці № 530474 – 530494, 530504 – 530506, 530522 – 530531)	вул.Радянська, 16, м.Лубни, Полтавська обл., 37500	кінотеатр "Київська Русь"	219	154 253
149	місто Карлівка	Карлівський, Кобеляцький, Козельщинський, Машівський, Новосанжарський, Чутівський райони	вул.Леніна, 95, м.Карлівка, Карлівський р-н, Полтавська обл., 39500	Карлівський районний будинок культури	215	150 484
150	місто Комсомольськ	місто Комсомольськ, частина Автозаводського району міста Кременчука (виборчі дільниці № 531086 – 531098), Глобинський, Кременчуцький райони	вул.Космонавтів, 4, м.Комсомольськ, Полтавська обл., 39800	відділ підготовки кадрів ВАТ "Полтавський ГЗК"	127	150 592
151	місто Лохвиця	Гадяцький, Гребінківський, Лохвицький, Пирятинський, Чорнухинський райони, частина Лубенського району (виборчі дільниці № 530495 – 530503, 530507 – 530521)	вул.Перемоги, 1, м.Лохвиця, Лохвицький р-н, Полтавська обл., 37200	приміщення Лохвицької райдержадміністрації	220	147 704
152	місто Рівне	частина міста Рівного (виборчі дільниці № 560901 – 560974, 560984 – 561002)	вул.Гагаріна, 6, м.Рівне, 33000	Рівненський міський палац культури	94	172 603
153	місто Рівне	місто Острог, частина міста Рівного (виборчі дільниці № 560975 – 560983), Гощанський, Корецький, Острозький, Рівненський райони	вул.Дніпровська, 4, м.Рівне, 33001	філія поліклініки Рівненської центральної районної лікарні	230	176 213
154	місто Дубно	місто Дубно, Демидівський, Дубенський, Здолбунівський, Млинівський, Радивилівський райони	вул.Д.Галицького, 17, м.Дубно, Рівненська обл., 35600	приміщення Дубенської райдержадміністрації	266	180 130
155	місто Дубровиця	місто Кузнецовськ, Володимирецький, Дубровицький, Зарічненський, Рокитнівський райони	вул.Воробинська, 16, м.Дубровиця, Дубровицький р-н, Рівненська обл., 34100	приміщення Дубровицької райдержадміністрації	212	173 401
156	місто Сарни	Березнівський, Костопільський, Сарненський райони	вул.Ковельська, 9, м.Сарни, Сарненський р-н, Рівненська обл., 34500	будинок дітей та молоді	200	168 989
157	місто Суми	Ковпаківський район, частина Зарічного району міста Сум (виборчі дільниці № 590884 – 590895, 590926 – 590943, 591015), село Піщане Сумської міської ради з населеними пунктами Піщанської сільської ради	вул. Горького, 21, м.Суми, 40004	приміщення Сумської міської ради	100	179 266
158	місто Білопілля	частина Зарічного району міста Сум (виборчі дільниці № 590896 – 590925, 590944 – 590946), Білопільський, Краснопільський, Сумський райони	вул.Старопутивльська, 35, м.Білопілля, Білопільський р-н, Сумська обл., 41800	приміщення Білопільської районної ради	190	175 682
159	місто Глухів	місто Глухів, Глухівський, Путивльський, Середино-Будський, Ямпільський райони, частина Кролевецького (виборчі дільниці № 590260 –590274, 590276 – 590278, 590280, 590282 – 590284, 590287, 590288, 590291, 590295 – 590299), частина Конотопського (виборчі дільниці № 590176, 590177, 590181 – 590183, 590185, 590186, 590188, 590190 – 590192, 590196 –590198, 590210, 590213), частина Шосткінського (виборчі дільниці № 590679 – 590688, 590694 – 590699) районів	вул.Путивльська, 1, м.Глухів, Сумська обл., 41400	міський центр дитячої та юнацької творчості	224	146 948
160	місто Шостка	міста Конотоп, Шостка, частина Конотопського (виборчі дільниці № 590179, 590180, 590200, 590207, 590208), частина Кролевецького (виборчі дільниці № 590275, 590279, 590281, 590285, 590286, 590289, 590290, 590292 – 590294), частина Шосткінського (виборчі дільниці № 590675 –590678, 590689 – 590693, 590700 – 590703) районів	вул.Леніна, 14, м.Шостка, Сумська обл., 41100	приміщення Шосткинської міської ради	99	147 395
161	місто Ромни	місто Ромни, Буринський, Липоводолинський, Недригайлівський, Роменський райони, частина Конотопського району (виборчі дільниці № 590172 – 590175, 590178, 590184, 590187, 590189, 590193 – 590195, 590199, 590201 – 590206, 590209, 590211, 590212, 590214 –590218)	бульв.Шевченка, 6, м.Ромни, Сумська обл., 42000	Роменський міський будинок культури	229	148 782
162	місто Охтирка	міста Лебедин, Охтирка, Великописарівський, Лебединський, Охтирський, Тростянецький райони	вул.Леніна, 1, м.Охтирка, Охтирський р-н, Сумська обл., 42700	приміщення управління праці та соціального захисту населення Охтирської міської ради	174	147 841
163	місто Тернопіль	частина міста Тернополя (виборчі дільниці № 611096 – 611181)	вул.Миру, 6, м.Тернопіль, 46000	палац культури Леся Курбаса "Березіль"	86	177 378
164	місто Збараж	Збаразький, Лановецький, Підволочиський, Шумський райони, частина Кременецького району (виборчі дільниці № 610544 – 610552, 610554 – 610587, 610591, 610592, 610596 – 610604, 610607, 610609, 610610, 610613 – 610616)	вул.Незалежності, 8, м.Збараж, Збаразький р-н, Тернопільська обл., 47302	Національний заповідник "Замки Тернопілля"	307	177 577
165	місто Зборів	частина міста Тернополя (виборчі дільниці № 611092 – 611095), Бережанський, Зборівський, Козівський, Підгаєцький, Тернопільський райони, частина Кременецького району (виборчі дільниці № 610542, 610543, 610553, 610588 – 610590, 610593 – 610595, 610605, 610606, 610608, 610611, 610612)	вул.Миру, 6, м.Зборів, Зборівськийр-н, Тернопільська обл., 47201	приміщення територіального центру Зборівської райдержадміністрації	311	178 352
166	місто Теребовля	Бучацький, Гусятинський, Монастириський, Теребовлянський райони	вул.22 Січня, 17, м.Теребовля, Теребовлянський р-н, Тернопільськаобл., 48100	спортивний комплекс	270	175 509
167	місто Чортків	Борщівський, Заліщицький, Чортківський райони	вул.Шевченка, 23, м.Чортків, Чортківський р-н, Тернопільськаобл., 48500	приміщення Чортківської районної ради	210	154 725
168	місто Харків, Дзержинський район	Дзержинський район міста Харкова	просп.Леніна, 17а, м.Харків, 61200	приміщення адміністрації Дзержинського району Харківської міської ради	88	169 341
169	місто Харків, Київський район	Київський район, частина Московського району міста Харкова (виборчі дільниці № 631415 – 631421, 631481 – 631484, 631525 – 631527)	вул.Чернишевська, 55, м.Харків, 61002	приміщення адміністрації Київського району Харківської міської ради	99	163 827
